@_fa,prism:url,eid,dc:title,dc:creator,prism:publicationName,prism:issn,prism:volume,prism:pageRange,prism:coverDate,prism:coverDisplayDate,prism:doi,citedby-count,affiliation,prism:aggregationType,subtype,subtypeDescription,openaccess,openaccessFlag,prism:eIssn,freetoread,freetoreadLabel,prism:issueIdentifier
true,https://api.elsevier.com/content/abstract/scopus_id/105028966468,2-s2.0-105028966468,Influence of carbon on microstructural stability and stress rupture properties of an additively manufactured superalloy,Chen S.F.,China Foundry,16726421,,,2026-01-01,2026,10.1007/s41230-026-5025-5,0,"[{'@_fa': 'true', 'affilname': 'Institute of Metal Research Chinese Academy of Sciences', 'affiliation-city': 'Shenyang', 'affiliation-country': 'China'}, {'@_fa': 'true', 'affilname': 'The State Key Laboratory of Rolling and Automation, Northeastern University', 'affiliation-city': 'Shenyang', 'affiliation-country': 'China'}, {'@_fa': 'true', 'affilname': 'TaiHang Laboratory', 'affiliation-city': 'Chengdu', 'affiliation-country': 'China'}]",Journal,ar,Article,1,True,23659459,"{'value': [{'$': 'all'}, {'$': 'publisherfullgold'}]}","{'value': [{'$': 'All Open Access'}, {'$': 'Gold'}]}",
true,https://api.elsevier.com/content/abstract/scopus_id/105027899047,2-s2.0-105027899047,Influence of Post-Processing on S-Phase Formation During Plasma Nitriding of Additively Manufactured Inconel 939,Maj P.,Materials,,19,,2026-01-01,January 2026,10.3390/ma19010130,0,"[{'@_fa': 'true', 'affilname': 'Politechnika Warszawska', 'affiliation-city': 'Warsaw', 'affiliation-country': 'Poland'}, {'@_fa': 'true', 'affilname': 'Institute of Physics of the Polish Academy of Sciences', 'affiliation-city': 'Warsaw', 'affiliation-country': 'Poland'}, {'@_fa': 'true', 'affilname': 'Cardinal Stefan Wyszynski University in Warsaw', 'affiliation-city': 'Warsaw', 'affiliation-country': 'Poland'}, {'@_fa': 'true', 'affilname': 'Narodowe Centrum Badań Jądrowych, Otwock', 'affiliation-city': 'Otwock', 'affiliation-country': 'Poland'}]",Journal,ar,Article,1,True,19961944,"{'value': [{'$': 'all'}, {'$': 'publisherfullgold'}, {'$': 'repository'}, {'$': 'repositoryam'}]}","{'value': [{'$': 'All Open Access'}, {'$': 'Gold'}, {'$': 'Green'}]}",1
true,https://api.elsevier.com/content/abstract/scopus_id/105028130647,2-s2.0-105028130647,"HEAT-RESISTANT POWDER ALLOYS IN ADDITIVE MANUFACTURING: MATERIALS, APPLICATION, AND PERSPECTIVES",Duriagina Z.A.,Progress in Physics of Metals,16081021,26,863-908,2025-01-01,2025,10.15407/ufm.26.04.863,0,"[{'@_fa': 'true', 'affilname': 'Lviv Polytechnic National University', 'affiliation-city': 'Lviv', 'affiliation-country': 'Ukraine'}, {'@_fa': 'true', 'affilname': 'Oles Honchar Dnipro National University', 'affiliation-city': 'Dnipro', 'affiliation-country': 'Ukraine'}, {'@_fa': 'true', 'affilname': 'Leeds University Business School', 'affiliation-city': 'Leeds', 'affiliation-country': 'United Kingdom'}, {'@_fa': 'true', 'affilname': 'Anatolii Pidhornyi Institute of Power Machines and Systems of the National academy of sciences of Ukraine', 'affiliation-city': 'Kharkiv', 'affiliation-country': 'Ukraine'}]",Journal,ar,Article,1,True,26170795,"{'value': [{'$': 'all'}, {'$': 'publisherfullgold'}, {'$': 'repository'}, {'$': 'repositoryam'}]}","{'value': [{'$': 'All Open Access'}, {'$': 'Gold'}, {'$': 'Green'}]}",4
true,https://api.elsevier.com/content/abstract/scopus_id/105029403871,2-s2.0-105029403871,EFFECT OF HOT ISOSTATIC PRESSING ON THE MICROSTRUCTURAL EVOLUTION AND TENSILE PROPERTIES OF LASER POWDER BED FUSION-PROCESSED Co-BASED SUPERALLOY MAR-M-509A,Skotnicová K.,Metal International Conference on Metallurgy and Materials Conference Proceedings,,2025,504-510,2025-01-01,2025,10.37904/metal.2025.5150,0,"[{'@_fa': 'true', 'affilname': 'VSB – Technical University of Ostrava', 'affiliation-city': 'Ostrava', 'affiliation-country': 'Czech Republic'}]",Journal,cp,Conference Paper,1,True,26949296,"{'value': [{'$': 'all'}, {'$': 'publisherhybridgold'}]}","{'value': [{'$': 'All Open Access'}, {'$': 'Hybrid Gold'}]}",2025
true,https://api.elsevier.com/content/abstract/scopus_id/105027994873,2-s2.0-105027994873,Microstructural and mechanical characterization of stainless steel 420 and Inconel 718 multi-material structures fabricated using laser directed energy deposition,Aydogan B.,Journal of Manufacturing Processes,15266125,68,1224-1235,2021-08-01,August 2021,10.1016/j.jmapro.2021.06.031,40,"[{'@_fa': 'true', 'affilname': 'College of Engineering', 'affiliation-city': 'East Lansing', 'affiliation-country': 'United States'}]",Journal,ar,Article,0,False,,,,
