@_fa,prism:url,eid,dc:title,dc:creator,prism:publicationName,prism:issn,prism:volume,prism:pageRange,prism:coverDate,prism:coverDisplayDate,prism:doi,citedby-count,affiliation,prism:aggregationType,subtype,subtypeDescription,openaccess,openaccessFlag,prism:eIssn,freetoread,freetoreadLabel,prism:issueIdentifier
true,https://api.elsevier.com/content/abstract/scopus_id/105026652631,2-s2.0-105026652631,Unexpected solidification cracking behavior in yttrium-modified Hastelloy-X superalloy fabricated by direct energy deposition,Jiao D.,Journal of Materials Science and Technology,10050302,267,1-12,2026-10-01,1 October 2026,10.1016/j.jmst.2025.12.039,0,"[{'@_fa': 'true', 'affilname': 'Nanjing University of Science and Technology', 'affiliation-city': 'Nanjing', 'affiliation-country': 'China'}, {'@_fa': 'true', 'affilname': 'State Key Laboratory of Solidification Processing', 'affiliation-city': ""Xi'an"", 'affiliation-country': 'China'}, {'@_fa': 'true', 'affilname': 'Shanghai Institute of Microsystem and Information Technology Chinese Academy of Sciences', 'affiliation-city': 'Shanghai', 'affiliation-country': 'China'}, {'@_fa': 'true', 'affilname': 'AECC Commercial Aircraft Engine Co., Ltd', 'affiliation-city': 'Shanghai', 'affiliation-country': 'China'}, {'@_fa': 'true', 'affilname': 'Ltd.', 'affiliation-city': ""Xi'an"", 'affiliation-country': 'China'}]",Journal,ar,Article,0,False,,,,
true,https://api.elsevier.com/content/abstract/scopus_id/105026964735,2-s2.0-105026964735,Process gas influence on Very-High-Cycle fatigue response of Inconel 718 fabricated by laser powder bed fusion,Rauf A.,International Journal of Fatigue,01421123,206,,2026-05-01,May 2026,10.1016/j.ijfatigue.2025.109460,0,"[{'@_fa': 'true', 'affilname': 'KU Leuven', 'affiliation-city': 'Leuven', 'affiliation-country': 'Belgium'}, {'@_fa': 'true', 'affilname': 'Samuel Ginn College of Engineering', 'affiliation-city': 'Auburn', 'affiliation-country': 'United States'}]",Journal,ar,Article,0,False,,,,
true,https://api.elsevier.com/content/abstract/scopus_id/105027244896,2-s2.0-105027244896,Optimized processing parameters for crack-free fabrication of unweldable Inconel 738LC via directed energy deposition,Ekubaru Y.,Optics and Laser Technology,00303992,196,,2026-04-01,April 2026,10.1016/j.optlastec.2026.114727,0,"[{'@_fa': 'true', 'affilname': 'Nikon Corporation', 'affiliation-city': 'Tokyo', 'affiliation-country': 'Japan'}, {'@_fa': 'true', 'affilname': 'Technology Nikon AM', 'affiliation-city': 'Long Beach', 'affiliation-country': 'United States'}]",Journal,ar,Article,1,True,,,,
true,https://api.elsevier.com/content/abstract/scopus_id/105027568074,2-s2.0-105027568074,A theoretical model for predicting multi-cracking susceptibility in Ni-based superalloys fabricated by additive manufacturing,Li M.,Journal of Materials Processing Technology,09240136,349,,2026-03-01,March 2026,10.1016/j.jmatprotec.2026.119219,0,"[{'@_fa': 'true', 'affilname': 'State Key Laboratory for Manufacturing Systems Engineering', 'affiliation-city': ""Xi'an"", 'affiliation-country': 'China'}]",Journal,ar,Article,0,False,18734774,,,
true,https://api.elsevier.com/content/abstract/scopus_id/105027956524,2-s2.0-105027956524,SiC induced in-situ modification: Microstructure and properties of fine-grained SiC/GH3536 Ni-superalloy composites fabricated by laser powder bed fusion,Liang Z.,Journal of Alloys and Compounds,09258388,1054,,2026-02-10,10 February 2026,10.1016/j.jallcom.2026.186362,0,"[{'@_fa': 'true', 'affilname': 'South China University of Technology', 'affiliation-city': 'Guangzhou', 'affiliation-country': 'China'}, {'@_fa': 'true', 'affilname': 'Guangzhou University', 'affiliation-city': 'Guangzhou', 'affiliation-country': 'China'}, {'@_fa': 'true', 'affilname': 'Guangzhou Maritime University', 'affiliation-city': 'Guangzhou', 'affiliation-country': 'China'}]",Journal,ar,Article,0,False,,,,
true,https://api.elsevier.com/content/abstract/scopus_id/105027046735,2-s2.0-105027046735,On the anisotropic creep behavior of a Ni-base superalloy CM247LC manufactured by powder bed fusion – laser beam,Fardan A.,Materials Science and Engineering A,09215093,953,,2026-02-01,February 2026,10.1016/j.msea.2025.149707,0,"[{'@_fa': 'true', 'affilname': 'Chalmers University of Technology', 'affiliation-city': 'Gothenburg', 'affiliation-country': 'Sweden'}, {'@_fa': 'true', 'affilname': 'Linköpings Universitet', 'affiliation-city': 'Linkoping', 'affiliation-country': 'Sweden'}, {'@_fa': 'true', 'affilname': 'Siemens Energy AB', 'affiliation-city': 'Finspang', 'affiliation-country': 'Sweden'}, {'@_fa': 'true', 'affilname': 'EOS Electro Optical Systems Finland Oy', 'affiliation-city': 'Turku', 'affiliation-country': 'Finland'}, {'@_fa': 'true', 'affilname': 'Quintus Technologies AB', 'affiliation-city': 'Vasteras', 'affiliation-country': 'Sweden'}]",Journal,ar,Article,0,False,,,,
true,https://api.elsevier.com/content/abstract/scopus_id/105027086534,2-s2.0-105027086534,"Metallic lattice structures via additive manufacturing: Applications, challenges and opportunities in aerospace and defence",Akula S.B.,Journal of Manufacturing Processes,15266125,157,1308-1336,2026-01-17,17 January 2026,10.1016/j.jmapro.2025.12.045,0,"[{'@_fa': 'true', 'affilname': 'Gyeongsang National University', 'affiliation-city': 'Jinju', 'affiliation-country': 'South Korea'}, {'@_fa': 'true', 'affilname': 'Indian Institute of Technology Hyderabad', 'affiliation-city': 'Sangareddy', 'affiliation-country': 'India'}, {'@_fa': 'true', 'affilname': 'Indian Institute of Information Technology Design and Manufacturing Kurnool', 'affiliation-city': 'Kurnool', 'affiliation-country': 'India'}, {'@_fa': 'true', 'affilname': 'DRDO Combat Vehicles Research and Development Establishment', 'affiliation-city': 'Chennai', 'affiliation-country': 'India'}, {'@_fa': 'true', 'affilname': 'Vasireddy Venkatadri International Technological University', 'affiliation-city': 'Guntur', 'affiliation-country': 'India'}]",Journal,re,Review,0,False,,,,
true,https://api.elsevier.com/content/abstract/scopus_id/105027103089,2-s2.0-105027103089,Macroscale simulation and experimental correlation of Wire Arc Additive Manufacturing of IN-82 superalloy,Kumar R.,Journal of Alloys and Compounds,09258388,1050,,2026-01-15,15 January 2026,10.1016/j.jallcom.2025.185869,0,"[{'@_fa': 'true', 'affilname': 'Indian Institute of Technology (Indian School of Mines), Dhanbad', 'affiliation-city': 'Dhanbad', 'affiliation-country': 'India'}]",Journal,ar,Article,0,False,,,,
true,https://api.elsevier.com/content/abstract/scopus_id/105027131927,2-s2.0-105027131927,Microstructural evolution and mechanical behavior of additively manufactured IN939 superalloy at room and elevated temperatures,Shahwaz M.,Journal of Alloys and Compounds,09258388,1050,,2026-01-15,15 January 2026,10.1016/j.jallcom.2026.185949,0,"[{'@_fa': 'true', 'affilname': 'Indian Institute of Technology Kharagpur', 'affiliation-city': 'Kharagpur', 'affiliation-country': 'India'}, {'@_fa': 'true', 'affilname': 'Dublin City University', 'affiliation-city': 'Dublin', 'affiliation-country': 'Ireland'}, {'@_fa': 'true', 'affilname': 'ANSYS, Inc.', 'affiliation-city': 'Canonsburg', 'affiliation-country': 'United States'}]",Journal,ar,Article,0,False,,,,
true,https://api.elsevier.com/content/abstract/scopus_id/105027803177,2-s2.0-105027803177,"Review on Additive Manufacturing of Nickel-Based Single-Crystal Superalloys: Epitaxial Growth, Crack Mitigation, and Performance Correlation",Li C.,JOM,10474838,,,2026-01-01,2026,10.1007/s11837-025-08103-6,0,"[{'@_fa': 'true', 'affilname': 'University of Chinese Academy of Sciences', 'affiliation-city': 'Beijing', 'affiliation-country': 'China'}, {'@_fa': 'true', 'affilname': 'Institute of Metal Research Chinese Academy of Sciences', 'affiliation-city': 'Shenyang', 'affiliation-country': 'China'}, {'@_fa': 'true', 'affilname': 'Chongqing Jiaotong University', 'affiliation-city': 'Chongqing', 'affiliation-country': 'China'}, {'@_fa': 'true', 'affilname': 'Chongqing Institute of Green and Intelligent Technology', 'affiliation-city': 'Chongqing', 'affiliation-country': 'China'}, {'@_fa': 'true', 'affilname': 'Chongqing Key Laboratory of Additive Manufacturing Technology and Systems', 'affiliation-city': 'Chongqing', 'affiliation-country': 'China'}]",Journal,re,Review,0,False,15431851,,,
true,https://api.elsevier.com/content/abstract/scopus_id/105028213005,2-s2.0-105028213005,Process Optimization and Microstructural Characterization of Inconel 718 Fabricated via Wire Arc Additive Manufacturing,Kishore M.,Journal of Materials Engineering and Performance,10599495,,,2026-01-01,2026,10.1007/s11665-026-13192-8,0,"[{'@_fa': 'true', 'affilname': 'King Faisal University', 'affiliation-city': 'Al-Ahsa', 'affiliation-country': 'Saudi Arabia'}, {'@_fa': 'true', 'affilname': 'Indian Institute of Technology Indore', 'affiliation-city': 'Indore', 'affiliation-country': 'India'}, {'@_fa': 'true', 'affilname': 'College of Engineering, Guindy', 'affiliation-city': 'Chennai', 'affiliation-country': 'India'}]",Journal,ar,Article,0,False,15441024,,,
true,https://api.elsevier.com/content/abstract/scopus_id/105028130862,2-s2.0-105028130862,A critical review on additive manufacturing of refractory alloys from a data analytics perspective- beyond nickel-based superalloys,Kim D.B.,Virtual and Physical Prototyping,17452759,,,2026-01-01,2026,10.1080/17452759.2025.2604453,0,"[{'@_fa': 'true', 'affilname': 'Korea Advanced Institute of Science and Technology', 'affiliation-city': 'Daejeon', 'affiliation-country': 'South Korea'}, {'@_fa': 'true', 'affilname': 'Oak Ridge National Laboratory', 'affiliation-city': 'Oak Ridge', 'affiliation-country': 'United States'}, {'@_fa': 'true', 'affilname': 'National Institute of Standards and Technology', 'affiliation-city': 'Gaithersburg', 'affiliation-country': 'United States'}, {'@_fa': 'true', 'affilname': 'Air Force Research Laboratory', 'affiliation-city': 'Dayton', 'affiliation-country': 'United States'}, {'@_fa': 'true', 'affilname': 'Sandia National Laboratories, New Mexico', 'affiliation-city': 'Albuquerque', 'affiliation-country': 'United States'}, {'@_fa': 'true', 'affilname': 'Tickle College of Engineering', 'affiliation-city': 'Knoxville', 'affiliation-country': 'United States'}, {'@_fa': 'true', 'affilname': 'Ajou University', 'affiliation-city': 'Suwon', 'affiliation-country': 'South Korea'}, {'@_fa': 'true', 'affilname': 'College of Engineering', 'affiliation-city': 'Athens', 'affiliation-country': 'United States'}, {'@_fa': 'true', 'affilname': 'University of South Carolina - Aiken', 'affiliation-city': 'Aiken', 'affiliation-country': 'United States'}, {'@_fa': 'true', 'affilname': 'Transportation Research Institute (IMOB)', 'affiliation-city': 'Hasselt', 'affiliation-country': 'Belgium'}]",Journal,re,Review,1,True,17452767,"{'value': [{'$': 'all'}, {'$': 'publisherfullgold'}, {'$': 'repository'}, {'$': 'repositoryam'}]}","{'value': [{'$': 'All Open Access'}, {'$': 'Gold'}, {'$': 'Green'}]}",
true,https://api.elsevier.com/content/abstract/scopus_id/105026508156,2-s2.0-105026508156,Correlating Part Geometry to Microstructures in Electron Powder Bed Fusion Additive Manufacturing of Alloy 718,Haines M.P.,Metallurgical and Materials Transactions A Physical Metallurgy and Materials Science,10735623,,,2026-01-01,2026,10.1007/s11661-025-08069-9,0,"[{'@_fa': 'true', 'affilname': 'Imperial College London', 'affiliation-city': 'London', 'affiliation-country': 'United Kingdom'}, {'@_fa': 'true', 'affilname': 'A. James Clark School of Engineering', 'affiliation-city': 'College Park', 'affiliation-country': 'United States'}, {'@_fa': 'true', 'affilname': 'University of New South Wales, School of Materials Science and Engineering', 'affiliation-city': 'Kensington', 'affiliation-country': 'Australia'}]",Journal,ar,Article,0,False,15431940,,,
true,https://api.elsevier.com/content/abstract/scopus_id/105027474556,2-s2.0-105027474556,Inconel 625/Al2O3 functionally graded materials manufactured by directed energy deposition,Yu H.Y.,Journal of Materials Research and Technology,22387854,40,3509-3520,2026-01-01,January - February 2026,10.1016/j.jmrt.2026.01.064,0,"[{'@_fa': 'true', 'affilname': 'Tohoku University', 'affiliation-city': 'Sendai', 'affiliation-country': 'Japan'}, {'@_fa': 'true', 'affilname': 'Pusan National University', 'affiliation-city': 'Busan', 'affiliation-country': 'South Korea'}, {'@_fa': 'true', 'affilname': 'Pohang University of Science and Technology', 'affiliation-city': 'Pohang', 'affiliation-country': 'South Korea'}, {'@_fa': 'true', 'affilname': 'Gyeongsang National University', 'affiliation-city': 'Jinju', 'affiliation-country': 'South Korea'}, {'@_fa': 'true', 'affilname': 'Kyungnam University', 'affiliation-city': 'Changwon', 'affiliation-country': 'South Korea'}]",Journal,ar,Article,1,True,22140697,"{'value': [{'$': 'all'}, {'$': 'publisherfullgold'}]}","{'value': [{'$': 'All Open Access'}, {'$': 'Gold'}]}",
true,https://api.elsevier.com/content/abstract/scopus_id/105027935365,2-s2.0-105027935365,"Hot isostatic pressing of additively manufactured metallic components: A critical review on microstructure, mechanical, and corrosion properties",Aghayar Y.,Journal of Materials Research and Technology,22387854,40,3343-3381,2026-01-01,January - February 2026,10.1016/j.jmrt.2025.12.306,0,"[{'@_fa': 'true', 'affilname': 'Marine Additive Manufacturing Centre of Excellence', 'affiliation-city': 'Fredericton', 'affiliation-country': 'Canada'}]",Journal,ar,Article,1,True,22140697,"{'value': [{'$': 'all'}, {'$': 'publisherfullgold'}]}","{'value': [{'$': 'All Open Access'}, {'$': 'Gold'}]}",
true,https://api.elsevier.com/content/abstract/scopus_id/105027143359,2-s2.0-105027143359,Effect of carbon content and heat treatment on the tensile properties of additive manufactured superalloys ZGH98M,Zhao Y.,Journal of Materials Research,08842914,,,2026-01-01,2026,10.1557/s43578-025-01772-8,0,"[{'@_fa': 'true', 'affilname': 'University of Auckland', 'affiliation-city': 'Auckland', 'affiliation-country': 'New Zealand'}, {'@_fa': 'true', 'affilname': 'Institute of Metal Research Chinese Academy of Sciences', 'affiliation-city': 'Shenyang', 'affiliation-country': 'China'}, {'@_fa': 'true', 'affilname': 'Liaoning Petrochemical University', 'affiliation-city': 'Fushun', 'affiliation-country': 'China'}]",Journal,ar,Article,0,False,20445326,,,
true,https://api.elsevier.com/content/abstract/scopus_id/105027844067,2-s2.0-105027844067,Evaluating Thermodynamics-Based Hot-Cracking Models for Various AM Alloys,Jordan A.M.,Integrating Materials and Manufacturing Innovation,21939764,,,2026-01-01,2026,10.1007/s40192-025-00437-y,0,"[{'@_fa': 'true', 'affilname': 'Department of Metallurgical and Materials Engineering', 'affiliation-city': 'Tuscaloosa', 'affiliation-country': 'United States'}]",Journal,ar,Article,0,False,21939772,,,
true,https://api.elsevier.com/content/abstract/scopus_id/105028331904,2-s2.0-105028331904,Turn Nonweldable Ni-Superalloys Printable and Microstructurally Controllable,Wang Z.,Advanced Materials,09359648,,,2026-01-01,2026,10.1002/adma.202517003,0,"[{'@_fa': 'true', 'affilname': ""Xi'an Jiaotong University"", 'affiliation-city': ""Xi'an"", 'affiliation-country': 'China'}, {'@_fa': 'true', 'affilname': 'Guizhou University', 'affiliation-city': 'Guiyang', 'affiliation-country': 'China'}, {'@_fa': 'true', 'affilname': 'School of Mechanical and Aerospace Engineering', 'affiliation-city': 'Singapore City', 'affiliation-country': 'Singapore'}, {'@_fa': 'true', 'affilname': 'A-Star, Advanced Remanufacturing and Technology Centre', 'affiliation-city': 'Singapore City', 'affiliation-country': 'Singapore'}]",Journal,re,Review,0,False,15214095,,,
true,https://api.elsevier.com/content/abstract/scopus_id/105028247821,2-s2.0-105028247821,Assessment of the cracking susceptibility of CM247LC alloy processed by PBF-LB: composition and process parameters influence,Gil E.,International Journal of Advanced Manufacturing Technology,02683768,,,2026-01-01,2026,10.1007/s00170-025-17329-2,0,"[{'@_fa': 'true', 'affilname': 'Lortek S.Coop.', 'affiliation-city': 'Ordizia', 'affiliation-country': 'Spain'}]",Journal,ar,Article,0,False,14333015,,,
true,https://api.elsevier.com/content/abstract/scopus_id/105027899047,2-s2.0-105027899047,Influence of Post-Processing on S-Phase Formation During Plasma Nitriding of Additively Manufactured Inconel 939,Maj P.,Materials,,19,,2026-01-01,January 2026,10.3390/ma19010130,0,"[{'@_fa': 'true', 'affilname': 'Politechnika Warszawska', 'affiliation-city': 'Warsaw', 'affiliation-country': 'Poland'}, {'@_fa': 'true', 'affilname': 'Institute of Physics of the Polish Academy of Sciences', 'affiliation-city': 'Warsaw', 'affiliation-country': 'Poland'}, {'@_fa': 'true', 'affilname': 'Cardinal Stefan Wyszynski University in Warsaw', 'affiliation-city': 'Warsaw', 'affiliation-country': 'Poland'}, {'@_fa': 'true', 'affilname': 'Narodowe Centrum Badań Jądrowych, Otwock', 'affiliation-city': 'Otwock', 'affiliation-country': 'Poland'}]",Journal,ar,Article,1,True,19961944,"{'value': [{'$': 'all'}, {'$': 'publisherfullgold'}, {'$': 'repository'}, {'$': 'repositoryam'}]}","{'value': [{'$': 'All Open Access'}, {'$': 'Gold'}, {'$': 'Green'}]}",1
true,https://api.elsevier.com/content/abstract/scopus_id/105026353566,2-s2.0-105026353566,"Precise tailoring of manufacturing processes for superalloys: strategy, methodology and validation",Zheng L.,Journal of Aeronautical Materials,10055053,45,1-25,2025-10-01,1 October 2025,10.11868/j.issn.1005-5053.2025.000158,0,"[{'@_fa': 'true', 'affilname': 'Beijing Institute of Aeronautical Materials', 'affiliation-city': 'Beijing', 'affiliation-country': 'China'}]",Journal,ar,Article,0,False,,,,5
true,https://api.elsevier.com/content/abstract/scopus_id/105026128969,2-s2.0-105026128969,"Forming quality, microstructure, and ductility-oriented mechanical performance of laser powder bed fusion processed Ni-based superalloy using different thermal input modes",Sun J.,Journal of Materials Research and Technology,22387854,36,9556-9571,2025-05-01,May - June 2025,10.1016/j.jmrt.2025.05.208,1,"[{'@_fa': 'true', 'affilname': 'Nanjing University of Aeronautics and Astronautics', 'affiliation-city': 'Nanjing', 'affiliation-country': 'China'}]",Journal,ar,Article,1,True,22140697,,,
true,https://api.elsevier.com/content/abstract/scopus_id/105028130647,2-s2.0-105028130647,"HEAT-RESISTANT POWDER ALLOYS IN ADDITIVE MANUFACTURING: MATERIALS, APPLICATION, AND PERSPECTIVES",Duriagina Z.A.,Progress in Physics of Metals,16081021,26,863-908,2025-01-01,2025,10.15407/ufm.26.04.863,0,"[{'@_fa': 'true', 'affilname': 'Lviv Polytechnic National University', 'affiliation-city': 'Lviv', 'affiliation-country': 'Ukraine'}, {'@_fa': 'true', 'affilname': 'Oles Honchar Dnipro National University', 'affiliation-city': 'Dnipro', 'affiliation-country': 'Ukraine'}, {'@_fa': 'true', 'affilname': 'Leeds University Business School', 'affiliation-city': 'Leeds', 'affiliation-country': 'United Kingdom'}, {'@_fa': 'true', 'affilname': 'Anatolii Pidhornyi Institute of Power Machines and Systems of the National academy of sciences of Ukraine', 'affiliation-city': 'Kharkiv', 'affiliation-country': 'Ukraine'}]",Journal,ar,Article,1,True,26170795,"{'value': [{'$': 'all'}, {'$': 'publisherfullgold'}]}","{'value': [{'$': 'All Open Access'}, {'$': 'Gold'}]}",4
true,https://api.elsevier.com/content/abstract/scopus_id/105026629761,2-s2.0-105026629761,Optimization of selective laser melting parameters and post-processing for enhanced mechanical properties of IN718 superalloy,Kurre P.K.R.,Rapid Prototyping Journal,13552546,,1-17,2025-01-01,2025,10.1108/RPJ-07-2025-0292,0,"[{'@_fa': 'true', 'affilname': 'Indian Institute of Technology Bombay', 'affiliation-city': 'Mumbai', 'affiliation-country': 'India'}, {'@_fa': 'true', 'affilname': 'K L Deemed to be University', 'affiliation-city': 'Vaddeswaram', 'affiliation-country': 'India'}, {'@_fa': 'true', 'affilname': 'SRM University-AP', 'affiliation-city': 'Mangalagiri', 'affiliation-country': 'India'}, {'@_fa': 'true', 'affilname': 'Liquid Propulsion Systems Centre, Valiamala', 'affiliation-city': 'Thiruvananthapuram', 'affiliation-country': 'India'}]",Journal,ar,Article,0,False,,,,
true,https://api.elsevier.com/content/abstract/scopus_id/105027994873,2-s2.0-105027994873,Microstructural and mechanical characterization of stainless steel 420 and Inconel 718 multi-material structures fabricated using laser directed energy deposition,Aydogan B.,Journal of Manufacturing Processes,15266125,68,1224-1235,2021-08-01,August 2021,10.1016/j.jmapro.2021.06.031,39,"[{'@_fa': 'true', 'affilname': 'College of Engineering', 'affiliation-city': 'East Lansing', 'affiliation-country': 'United States'}]",Journal,ar,Article,0,False,,,,
