@_fa,prism:url,eid,dc:title,dc:creator,prism:publicationName,prism:issn,prism:volume,prism:pageRange,prism:coverDate,prism:coverDisplayDate,prism:doi,citedby-count,affiliation,prism:aggregationType,subtype,subtypeDescription,openaccess,openaccessFlag,prism:eIssn,freetoread,freetoreadLabel,prism:issueIdentifier
true,https://api.elsevier.com/content/abstract/scopus_id/105028939607,2-s2.0-105028939607,Hot oxidation and corrosion resistance of nickel-based superalloy Inconel 617 fabricated by wire arc additive manufacturing for powerplant applications,Kannan A.R.,Materials Characterization,10445803,233,,2026-03-01,March 2026,10.1016/j.matchar.2026.116075,0,"[{'@_fa': 'true', 'affilname': 'National Institute of Technology Tiruchirappalli', 'affiliation-city': 'Tiruchirappalli', 'affiliation-country': 'India'}, {'@_fa': 'true', 'affilname': 'Incheon National University', 'affiliation-city': 'Incheon', 'affiliation-country': 'South Korea'}, {'@_fa': 'true', 'affilname': 'PSG Institute of Technology and Applied Research', 'affiliation-city': 'Coimbatore', 'affiliation-country': 'India'}, {'@_fa': 'true', 'affilname': 'RV Institute of Technology and Management', 'affiliation-city': 'Bengaluru', 'affiliation-country': 'India'}, {'@_fa': 'true', 'affilname': 'Coimbatore Institute of Engineering and Technology', 'affiliation-city': 'Coimbatore', 'affiliation-country': 'India'}]",Journal,ar,Article,0,False,,,,
true,https://api.elsevier.com/content/abstract/scopus_id/105028989797,2-s2.0-105028989797,Process-parameter-dependent defects formation mechanisms in laser powder bed fusion of non-weldable nickel-based superalloy,Bao Z.,Journal of Materials Research and Technology,22387854,41,2534-2555,2026-03-01,March - April 2026,10.1016/j.jmrt.2026.01.177,0,"[{'@_fa': 'true', 'affilname': 'Sichuan University', 'affiliation-city': 'Chengdu', 'affiliation-country': 'China'}]",Journal,ar,Article,1,True,22140697,"{'value': [{'$': 'all'}, {'$': 'publisherfullgold'}]}","{'value': [{'$': 'All Open Access'}, {'$': 'Gold'}]}",
true,https://api.elsevier.com/content/abstract/scopus_id/105028559591,2-s2.0-105028559591,Enhancement of the high-temperature strength of laser directed energy deposited IN738 through rational doping of nano-Y₂O₃,Zhang X.,Journal of Alloys and Compounds,09258388,1055,,2026-02-15,15 February 2026,10.1016/j.jallcom.2026.186459,0,"[{'@_fa': 'true', 'affilname': 'Jiangsu University of Science and Technology', 'affiliation-city': 'Zhenjiang', 'affiliation-country': 'China'}, {'@_fa': 'true', 'affilname': 'Ltd. of China National Machinery Institute Group', 'affiliation-city': 'Ningbo', 'affiliation-country': 'China'}]",Journal,ar,Article,0,False,,,,
true,https://api.elsevier.com/content/abstract/scopus_id/105028920334,2-s2.0-105028920334,"Room-temperature Electrochemical Corrosion Behavior of Nb-30Ti-20W Alloy Fabricated by Laser Additive Manufacturing in Acid, Alkali and Salt Solutions",Xie Z.,Surface Technology,10013660,55,145-156,2026-01-10,10 January 2026,10.16490/j.cnki.issn.1001-3660.2026.01.013,0,"[{'@_fa': 'true', 'affilname': 'China Academy of Engineering Physics', 'affiliation-city': 'Mianyang', 'affiliation-country': 'China'}, {'@_fa': 'true', 'affilname': 'Southwest Petroleum University China', 'affiliation-city': 'Chengdu', 'affiliation-country': 'China'}]",Journal,ar,Article,0,False,20976283,,,1
true,https://api.elsevier.com/content/abstract/scopus_id/105028589594,2-s2.0-105028589594,"Cellular Automata and Phase-Field Modeling of Microstructure Evolution in Metal Additive Manufacturing: Recent Advances, Hybrid Frameworks, and Pathways to Predictive Control",Łach Ł.,Metals,,16,,2026-01-01,January 2026,10.3390/met16010124,0,"[{'@_fa': 'true', 'affilname': 'AGH University of Krakow', 'affiliation-city': 'Krakow', 'affiliation-country': 'Poland'}]",Journal,re,Review,1,True,20754701,"{'value': [{'$': 'all'}, {'$': 'publisherfullgold'}]}","{'value': [{'$': 'All Open Access'}, {'$': 'Gold'}]}",1
true,https://api.elsevier.com/content/abstract/scopus_id/105028918151,2-s2.0-105028918151,"Corrosion Behavior of Laser Powder Bed Fused Inconel 718 Alloy after Hot Isostatic Pressing, Heat Treatment and Surface Peening",Lesyk D.,Lecture Notes in Mechanical Engineering,21954356,,456-466,2026-01-01,2026,10.1007/978-3-032-14926-8_38,0,"[{'@_fa': 'true', 'affilname': 'National Academy of Sciences of Ukraine', 'affiliation-city': 'Kyiv', 'affiliation-country': 'Ukraine'}, {'@_fa': 'true', 'affilname': 'Universidad del Pais Vasco', 'affiliation-city': 'Leioa', 'affiliation-country': 'Spain'}, {'@_fa': 'true', 'affilname': 'National Technical University of Ukraine “Igor Sikorsky Kyiv Polytechnic Institute”', 'affiliation-city': 'Kyiv', 'affiliation-country': 'Ukraine'}, {'@_fa': 'true', 'affilname': 'G. V. Kurdyumov Institute for Metal Physics, National Academy of Sciences of Ukraine', 'affiliation-city': 'Kyiv', 'affiliation-country': 'Ukraine'}, {'@_fa': 'true', 'affilname': 'Joint Stock Company Motor Sich', 'affiliation-city': 'Zaporizhzhia', 'affiliation-country': 'Ukraine'}]",Book Series,cp,Conference Paper,0,False,21954364,,,
true,https://api.elsevier.com/content/abstract/scopus_id/105028656333,2-s2.0-105028656333,Highly Printable Fe3Al Intermetallic Alloy,Emdadi A.,Metals,,16,,2026-01-01,January 2026,10.3390/met16010005,0,"[{'@_fa': 'true', 'affilname': 'Helmholtz-Zentrum Berlin für Materialien und Energie (HZB)', 'affiliation-city': 'Berlin', 'affiliation-country': 'Germany'}, {'@_fa': 'true', 'affilname': 'Brandenburg University of Technology Cottbus-Senftenberg', 'affiliation-city': 'Cottbus', 'affiliation-country': 'Germany'}]",Journal,ar,Article,1,True,20754701,"{'value': [{'$': 'all'}, {'$': 'publisherfullgold'}]}","{'value': [{'$': 'All Open Access'}, {'$': 'Gold'}]}",1
true,https://api.elsevier.com/content/abstract/scopus_id/105028966468,2-s2.0-105028966468,Influence of carbon on microstructural stability and stress rupture properties of an additively manufactured superalloy,Chen S.F.,China Foundry,16726421,,,2026-01-01,2026,10.1007/s41230-026-5025-5,0,"[{'@_fa': 'true', 'affilname': 'Institute of Metal Research Chinese Academy of Sciences', 'affiliation-city': 'Shenyang', 'affiliation-country': 'China'}, {'@_fa': 'true', 'affilname': 'The State Key Laboratory of Rolling and Automation, Northeastern University', 'affiliation-city': 'Shenyang', 'affiliation-country': 'China'}, {'@_fa': 'true', 'affilname': 'TaiHang Laboratory', 'affiliation-city': 'Chengdu', 'affiliation-country': 'China'}]",Journal,ar,Article,1,True,23659459,"{'value': [{'$': 'all'}, {'$': 'publisherfullgold'}]}","{'value': [{'$': 'All Open Access'}, {'$': 'Gold'}]}",
